{
  "schema_version": "2.0",
  "id": "ONLINE-EXPECTATION-MIGRATION-20261005",
  "route": "online-learning/chapter-2",
  "frontier_cell": "online-expectation",
  "source_facing": true,
  "source": {
    "kind": "book",
    "title": "Online Learning: A Modern Introduction Using Convex Optimization",
    "version": "arXiv:1912.13213v10,21 June2026; SHA256 cef4edfa97a6e063e53e9c532717c50aa156e5bc782ea49f969b3385011a1b17",
    "anchor": "Theorem2.9 printed11/PDF23 necessary signed-integral representation dependency; helpers not printed source statements and parent not accepted here.",
    "url": "https://arxiv.org/pdf/1912.13213v10"
  },
  "target": "Distinctly revalidate seven retained representation helpers/three definitions and qualify their existing Book reader; no proof code/new nodes or Jensen acceptance.",
  "affected_files": [
    "BanditRLProof/OnlineExpectation.lean",
    "website/content/readings.json",
    "website/content/highlights.json",
    "website/content/chapters.json"
  ],
  "declarations": [
    "BanditRL.OnlineConvex.positiveIntegral",
    "BanditRL.OnlineConvex.negativeIntegral",
    "BanditRL.OnlineConvex.signedExpectation",
    "BanditRL.OnlineConvex.positiveIntegral_coe",
    "BanditRL.OnlineConvex.negativeIntegral_coe",
    "BanditRL.OnlineConvex.positiveIntegral_coe_ne_top",
    "BanditRL.OnlineConvex.negativeIntegral_coe_ne_top",
    "BanditRL.OnlineConvex.signedExpectation_coe_integrable",
    "BanditRL.OnlineConvex.signedExpectation_of_nonneg",
    "BanditRL.OnlineConvex.signedExpectation_eq_top"
  ],
  "reuse_plan": {
    "classification": "reuse",
    "decision": "reuse_existing",
    "searched_existing": [
      "Actual10public declarations/native types, pinned Bochner/positive-negative/EReal APIs and fresh compiled shared-root10node317edge scopedgraph."
    ],
    "reused_declarations": [
      "BanditRL.OnlineConvex.positiveIntegral",
      "BanditRL.OnlineConvex.negativeIntegral",
      "BanditRL.OnlineConvex.signedExpectation",
      "BanditRL.OnlineConvex.positiveIntegral_coe",
      "BanditRL.OnlineConvex.negativeIntegral_coe",
      "BanditRL.OnlineConvex.positiveIntegral_coe_ne_top",
      "BanditRL.OnlineConvex.negativeIntegral_coe_ne_top",
      "BanditRL.OnlineConvex.signedExpectation_coe_integrable",
      "BanditRL.OnlineConvex.signedExpectation_of_nonneg",
      "BanditRL.OnlineConvex.signedExpectation_eq_top"
    ],
    "new_shared_declarations": [],
    "known_consumers": [
      "Tests.OnlineExpectationCanary",
      "BanditRLProof.OnlineJensen"
    ],
    "planned_consumers": [
      "Separate source Jensen migration after remaining dependency gates"
    ],
    "no_duplicate_wrapper": true,
    "decision_reason": "Seven unchanged proofs/three unchanged definitions/zero new proof code/nodes, one shared project."
  },
  "reader_contract": {
    "source_anchor_visible": true,
    "natural_language_formula_proof": true,
    "hidden_assumptions_visible": true,
    "source_vs_lean_delta_visible": true,
    "lean_folded": true,
    "dependencies_visible": true,
    "remaining_boundary_visible": true
  },
  "semantic_roundtrip": {
    "required": true,
    "status": "accepted",
    "formalizer": "/root",
    "blind_decoder": "/root/normal_blind",
    "source_reviewer": "/root/source_reviewer",
    "verdict": "accepted-with-explicit-delta",
    "remaining_semantic_delta": "Distinct source-contract/body review of representation dependencies under arbitrary measures; total arithmetic versus signed-integral interpretation/nonprobability canary/source parent boundary explicit. Final corrected reader/package review pending; no human/external/runtime attestation."
  },
  "graph_contribution": {
    "lean_graph": "reuse-only",
    "overview_graph": "updated",
    "functor_hypergraph": "none-found-with-reason",
    "functor_reason": "Retained signed-integral foundations; no cross-setting functor claim.",
    "focus_targets": [
      "BanditRL.OnlineConvex.positiveIntegral",
      "BanditRL.OnlineConvex.negativeIntegral",
      "BanditRL.OnlineConvex.signedExpectation",
      "BanditRL.OnlineConvex.positiveIntegral_coe",
      "BanditRL.OnlineConvex.negativeIntegral_coe",
      "BanditRL.OnlineConvex.positiveIntegral_coe_ne_top",
      "BanditRL.OnlineConvex.negativeIntegral_coe_ne_top",
      "BanditRL.OnlineConvex.signedExpectation_coe_integrable",
      "BanditRL.OnlineConvex.signedExpectation_of_nonneg",
      "BanditRL.OnlineConvex.signedExpectation_eq_top"
    ],
    "visual_review": "Fresh compiled10node317directedge scopedgraph; corrected reader/registry/site gates pending.",
    "edge_semantics": "formal-solid; overlays-dashed"
  },
  "progress_updates": {
    "teaching_route": "updated: same online-expectation route/4highlights/4links, arbitrary-measure/legitimate finite-part/actual Integrable/nonprobability/parent boundaries qualified.",
    "banditrlwiki": "no-change-with-reason: no new Bandit setting.",
    "results_ledger": "no-change-with-reason: additive task acceptance overlay follows gates; historical source inventory untouched.",
    "roadmap": "no-change-with-reason: whole-book Goal remains active, Chapter2 incomplete and global SGB untouched.",
    "website_surfaces": [
      "website/content/readings.json",
      "website/content/highlights.json",
      "website/content/chapters.json"
    ]
  },
  "truth_boundary": "Seven retained proofs/three retained definitions/zero new proof code/nodes. Arbitrary measure/no normalization; total lower integrals and EReal difference are not automatic measurable signed expectations. Actual Integrable real-f required for finite compatibility; a.e.nonnegative formal reduction and explicit finite-negative infinite-positive branch retained. Mass-two/counting canaries not probability Jensen instances. Parent source negative-part finiteness/Jensen/dependency distinct reviews remain required; Chapter2/allChapters1-16/main/live not complete or updated.",
  "verification": {
    "focused_checks": [
      "Fresh actual module/byte-exact fullcanary/18named standard3-or-none axioms/10native guards; all10headers/definition/proof tokens fixed."
    ],
    "bandit_check": "Fresh combined root/Tests/full harness pending recorded integration.",
    "site_build": "Clean lean-verified build only after fresh applicable combined gate.",
    "site_check": "Same10canonicalnodes/10806oldIDsURLs/source-qualified reader checks pending.",
    "independent_review": "Three distinct required automated actors, requested GPT-6 Astra/medium; no human/external review or independently attested runtime model."
  },
  "contributor": {
    "name": "Codex for Ji Cheng",
    "role": "Formalizer/integrator with distinct required automated semantic actors; source attribution retained"
  }
}
